{
  "schema": "crucix.basket.v1",
  "meta": {
    "id": "yield-curve",
    "source": "Crucix yield-curve (demo)",
    "source_url": "local://demo",
    "fetched_at": "2026-09-27T16:38:19.716Z",
    "normalized_at": "2026-09-27T16:38:27.022Z",
    "collector": "collect-yield-curve.mjs",
    "license": "proprietary",
    "count": 31,
    "granularity": "daily",
    "value_unit": "percent",
    "value_scale": "10y_minus_2y",
    "value_type": "ratio",
    "value_range": [
      0,
      100
    ]
  },
  "series": [
    {
      "date": "2026-08-28",
      "value": 1.33,
      "extra": {
        "y10": 4.99,
        "y2": 3.66
      }
    },
    {
      "date": "2026-08-29",
      "value": 1.04,
      "extra": {
        "y10": 4.95,
        "y2": 3.91
      }
    },
    {
      "date": "2026-08-30",
      "value": 1.69,
      "extra": {
        "y10": 4.92,
        "y2": 3.23
      }
    },
    {
      "date": "2026-08-31",
      "value": 1.14,
      "extra": {
        "y10": 4.34,
        "y2": 3.2
      }
    },
    {
      "date": "2026-09-01",
      "value": -0.32,
      "extra": {
        "y10": 4.03,
        "y2": 4.35
      }
    },
    {
      "date": "2026-09-02",
      "value": -0.55,
      "extra": {
        "y10": 3.95,
        "y2": 4.5
      }
    },
    {
      "date": "2026-09-03",
      "value": 0.28,
      "extra": {
        "y10": 3.51,
        "y2": 3.23
      }
    },
    {
      "date": "2026-09-04",
      "value": -0.07,
      "extra": {
        "y10": 4.38,
        "y2": 4.44
      }
    },
    {
      "date": "2026-09-05",
      "value": 0.96,
      "extra": {
        "y10": 4.76,
        "y2": 3.8
      }
    },
    {
      "date": "2026-09-06",
      "value": -0.69,
      "extra": {
        "y10": 3.85,
        "y2": 4.54
      }
    },
    {
      "date": "2026-09-07",
      "value": 1.2,
      "extra": {
        "y10": 4.31,
        "y2": 3.11
      }
    },
    {
      "date": "2026-09-08",
      "value": 1.02,
      "extra": {
        "y10": 4.04,
        "y2": 3.02
      }
    },
    {
      "date": "2026-09-09",
      "value": -0.07,
      "extra": {
        "y10": 4.32,
        "y2": 4.39
      }
    },
    {
      "date": "2026-09-10",
      "value": -0.58,
      "extra": {
        "y10": 4.12,
        "y2": 4.69
      }
    },
    {
      "date": "2026-09-11",
      "value": -0.79,
      "extra": {
        "y10": 3.67,
        "y2": 4.46
      }
    },
    {
      "date": "2026-09-12",
      "value": -0.42,
      "extra": {
        "y10": 4.43,
        "y2": 4.85
      }
    },
    {
      "date": "2026-09-13",
      "value": 0.6,
      "extra": {
        "y10": 4.03,
        "y2": 3.43
      }
    },
    {
      "date": "2026-09-14",
      "value": 1.1,
      "extra": {
        "y10": 4.39,
        "y2": 3.28
      }
    },
    {
      "date": "2026-09-15",
      "value": 1.76,
      "extra": {
        "y10": 4.82,
        "y2": 3.05
      }
    },
    {
      "date": "2026-09-16",
      "value": -0.06,
      "extra": {
        "y10": 4.53,
        "y2": 4.59
      }
    },
    {
      "date": "2026-09-17",
      "value": -0.36,
      "extra": {
        "y10": 4.26,
        "y2": 4.63
      }
    },
    {
      "date": "2026-09-18",
      "value": -0.92,
      "extra": {
        "y10": 4.01,
        "y2": 4.93
      }
    },
    {
      "date": "2026-09-19",
      "value": 0.16,
      "extra": {
        "y10": 4.97,
        "y2": 4.81
      }
    },
    {
      "date": "2026-09-20",
      "value": -0.65,
      "extra": {
        "y10": 3.64,
        "y2": 4.29
      }
    },
    {
      "date": "2026-09-21",
      "value": 0.08,
      "extra": {
        "y10": 4.53,
        "y2": 4.45
      }
    },
    {
      "date": "2026-09-22",
      "value": 1.33,
      "extra": {
        "y10": 4.43,
        "y2": 3.1
      }
    },
    {
      "date": "2026-09-23",
      "value": 0.36,
      "extra": {
        "y10": 4.8,
        "y2": 4.44
      }
    },
    {
      "date": "2026-09-24",
      "value": 0.18,
      "extra": {
        "y10": 4.46,
        "y2": 4.28
      }
    },
    {
      "date": "2026-09-25",
      "value": 0.42,
      "extra": {
        "y10": 4.92,
        "y2": 4.5
      }
    },
    {
      "date": "2026-09-26",
      "value": -0.76,
      "extra": {
        "y10": 4.04,
        "y2": 4.8
      }
    },
    {
      "date": "2026-09-27",
      "value": 0.58,
      "extra": {
        "y10": 4.92,
        "y2": 4.34
      }
    }
  ],
  "points": [],
  "regions": [
    {
      "region": "GLOBAL",
      "value": 0.29,
      "count": 31,
      "aggregation": "mean",
      "extra": {
        "max": 1.76,
        "sum": 8.99
      }
    }
  ],
  "documents": [],
  "graph": null,
  "extra": {
    "adapter": "timeseries",
    "adapter_version": "2.2.1",
    "unique_dates": 31,
    "unmapped_regions": [],
    "unmapped_count": 0
  }
}